80127,추격자: 침묵의 살인,5.15,청소년 관람불가,스릴러,마르코J리델,마르쿠스누프겐 찰스레팅하우스 로날드니츠키 야스민로드,닥터 록 가명 해적 방송 나이트 호크 진행 중 날 라 연쇄 연쇄살인범 살인범 청취자 대화 중 통 전화 통화 속 남자 중단 여자 살해 협박 최악 실수 고백 강요 수 기대 답 듯 충격적 범인 형사 브릭스 곳 딸 차 시체 발견 주변 조사 사건 라디오 생방송 출연 중이 인질 초조 추적 시작
159642,치어 댄스,8.03,전체 관람가,코미디,가와이하야토,히로세스즈 나카죠아야미 아마미유키,짝사랑 축구 부원 응원 댄스 도전 춤 춤알 알 히 히카 카 가입 조건 연애 금지 금지얼떨결 얼떨결 지옥 트레이닝 시작 팀워크 실력 학교 해체 통보 요즘 학생 열정 성격 목표 멤버 꿈 내 센터
157437,친구부부 : 욕망의 스와핑,5.09,청소년 관람불가,멜로/로맨스,이상우,시후 이수 민호 본새,대학 동기 출신 쌍 부부 선주 재용 태 태균 균 가희 오랜만 여행 술 중 시절 상대 배우자 하룻밤 섹스 처음 서로 외도 질투 순간 한번 자극 시작
165562,친구엄마: 그녀의 병간호,0.0,청소년 관람불가,멜로/로맨스,강정훈,,여의사 치루 근무 병원 원장 신 신타로 타로 왕성 성욕 주체 수 날 아들 신이 신이치가 치가 사고 입원 본능적 이치 유혹 농염 완숙 완숙미 미 속수무책 사람 아버지 애인 금기 서로
166190,친구엄마: 이혼한 그녀의 남자가 되던 날,0.0,청소년 관람불가,멜로/로맨스,강정훈,,코 코타로 타로 사고 아버지 운영 병원 입원 그곳 애인 여의사 츠 진료 그녀 친구 병실 날 이혼 이후 남자 맛 고백 안 육체
161367,친구엄마: 젊은 장모를 탐하다,5.5,청소년 관람불가,멜로/로맨스,이진,쿄우노미레이,결혼 반대 예비 장모 화가 나미 친구 그녀 유혹 남편 사별 후 10 10년 간 독수 독수공방 공방 섹스 비디오 촬영 협박 생각 오가 테크닉 관능 완숙 완숙미 미 함락 나미노 노 계획 차질 발생
153642,침묵,7.85,15세 관람가,드라마,정지우,최민식 박신혜 류준열 이하늬,재력 사랑 세상 남자 임 임태산최민 태산 최 민 식 행복 날 날약혼녀이자 약혼녀 이자 유명 가수 유 유나이하늬 나이 하늬 살해 용의 용의자로 자로 임미라이수경 미라 이수경 지목 세간 이목 집중 사건 사건임태산 그날 기억 딸 무죄 방식 시작 최고 변호인단 채 채미라 변호사 최희 최희정박신혜 정박 신 혜 선임 치열 법정 공방 영상 유나 팬 김동명 열 존재 예상 방향 약혼녀용의자 용의자 완벽
170642,침입자,5.48,15세 관람가,범죄 스릴러,이숭환,종호 이자은 김하림,엄마 생신 서울 딸 송영 송 송미세상 미 세상 행복 모녀 자비 살인 경찰 도망 연쇄 연쇄살인범 살인범 유재 유재마 마 감금 살인사건 사건 뒤 사실 치 앞 수 연쇄살인범과 범과 대치 상황
152396,카3: 새로운 도전,8.48,전체 관람가,애니메이션 모험 코미디 가족,브라이언피,오웬윌슨 크리스텔라알론조 아미해머,전세계 1 1위 위 자리 레이싱 전설 맥 맥퀸 퀸 날 최첨단 기술 무장 스톰 데뷔 경기 도중 무리 하다 치명적 부상 절망 맥퀸 실력파 트레이너 크루즈 새 도전 훈련 어려움 완벽 반격 최후 시작
165019,카르멘,0.0,15세 관람가,공연실황,카스퍼홀텐,가엘르아르퀘즈 다니엘요한슨,스페인 세비야 위병 위병근무 근무 하사관 돈 호세 고향 고향마을 마을 어머니 약혼녀 청년 중 담배 공장 집시 집시여인 여인 카르멘 동료 싸움 감옥 호 호세가 세가 그녀 호송 임무 유혹 고의 밀수꾼 패 합류 신세 이후 마음 투우사 에스 에스카미요 카 미 요 사랑 사실 격분 나머지 칼 후 주검 절규
163084,카메라맨과 모델,0.0,청소년 관람불가,드라마,오자키히로코우지,마키쿄코 아베코우지,결혼 3 3년 차인 마 마키 키 우연 기회 의류 모델 속옷 일도 얼떨결 촬영 묘 쾌감 집 번째 시작 대담 대담해지 해지 포즈 스텝 흥분
149394,카인드 오브 머더,5.53,15세 관람가,드라마 스릴러,앤디고다드,패트릭윌슨 제시카비엘 헤일리베넷,월터 터 스택 스택하우스 하우스 성공 건축가 아내 행복 삶 나의 유일한 취미 소설 날 우울증 자살 시도 파티 만난 여자 등장 의부증 목숨 무기 협박 완벽 파괴 그녀 꿈 기쁨 상상 시작 현실 통 전화 죽음 위험 살인 치명적
126011,"카페, 한 사람을 기다리다",7.73,15세 관람가,코미디 멜로/로맨스,강금림,송운화 브루스,사랑 아토 아토우 우 리 쓰잉 누군가 가슴 사람 카페 시작 러브 레 지수 200 렘 렘지수 500 500널 널 가능성
82473,캐리비안의 해적: 죽은 자는 말이 없다,8.28,12세 관람가,액션 모험 코미디 판타지,요아킴뢰닝,조니뎁 하비에르바르뎀 제프리러쉬 브렌튼스웨이츠 카야스코델라리오,전설적 해적 캡틴 잭 스패 우 뎁의 눈 앞 죽음 바다 학살자 라자 르 르하비 하비 바 바르 복수 사이 비밀 동료 서 사투 압도 거대 전투
163032,캠프 살인사건의 비밀,1.0,청소년 관람불가,스릴러,짐오레어,짐오레어 다니엘E.테일러,10 명 비만 남성 상금 100 100만 만 달러 빼기 경쟁 참가 다이 탈출기 리얼리티 프로그램 무게 가치 로스 캠핑 캠핑장 장 쇼 하루 만 참가자 이유 종적 미궁 피
146450,커피메이트,7.76,청소년 관람불가,멜로/로맨스,이현하,윤진서 오지호 김민서,카페 사람 구경 그녀 인영 곳 희수 신경 날 말 이야기 커피 메이트 남편 비밀 오랜만 숨 현실 자유로워지 감정 폭풍 관계 수
136869,컨택트,8.24,12세 관람가,드라마 SF 스릴러,드니빌뇌브,에이미아담스 제레미레너 포레스트휘태커,12 12개 개 외계 비행 물체 미국 중국 러시아 세계 각지 상공 등장 웨버 대령 대령포레스트 포 레스트 태 언어학 전문가 루이스 뱅크스 박사 아담스 과학자 이안 넬 넬리 리 레 레미 미 접촉 시작 사람 18 18시간 아래쪽 문 내부 진입 정체 생명체 15 15시간 내 지구 이유
152387,"컴, 투게더",8.05,15세 관람가,드라마,신동일,이혜은 임형국 채빈,실업자 135 135만 만 명 신용 신용불량자 불량자 100 100만 사교육비 교육비 18 18조 조 원 시대 대한 대한민국 민국 가족 위기 18년간 간 회사 해고 임 임형국 형국 과열 경쟁 라이벌 1 1위 위 자리 카드 카드영업사원 영업 사원 영이혜은 이혜 합격 합격소식 소식 재수생 한나 한나채 채 서로 문제 여유 사람 속 예상
157198,케이지 다이브,4.62,15세 관람가,드라마 공포 스릴러,제럴드라시오나토,조엘호건 메간페타힐 조시포트호프,이복 이복형제 형제 제프 조시 여자 여자친구 친구 메 메간 간 호주 여행 익스 익스트림 트림 쇼 오디션 참가 바다 상어 체험 케이지 다이빙 도전 중 예기 쓰나미 배 난파 밑 시작 물 위 사투 건 카메라 기록 실제 상황
164376,코만도: 라스트 액션 히어로,6.68,15세 관람가,액션,맷포이트라스,베론웰스 엘리라몬트,군인 시절 살인 병기 활약 나라 위험 인물 지목 정신 정신병원 병원 트릭 딸 체 니 편지 결혼 소식 보고 수상 생각 탈출 남 유일한 가족 맨 맨트릭스군부대 스군 부대 무기 곳 반가움 표정 맨트릭스 적 버렛 결혼상대 상대 충격 트릭스 앞 일당 포박 의문 약물 주입
169564,콘플릭트:야쿠자의 규율,10.0,청소년 관람불가,액션,토모마츠나오유키,,패망 길 야쿠자 정 탈퇴 손가락 잔인 규율 단합 날 균열 시작 신생 폭력단 침범 구역 한편 경시청 일망 일망타진 타진 전쟁 야기 묘수 두고 함정 잔혹
168148,콜 오브 듀티: 라스트 워,4.52,청소년 관람불가,액션,알렉산다르이비치크,케빈탄스키 로버트우들리 크리스클락 윌머트카,세 세르비아 르 비아 인명 인명구조 구조 작전 알 알파스쿼드 파스 쿼드 비밀 미션 부여 급 정보 수집 업무 대원 가족 휴식 장소 급파 그곳 세계 2 2차 차 대전 대전이후 이후 비밀리 모종 실험 니콜 니콜라스 라스 버그먼 박사 선친 연구 인간 질병 치유 영원 목숨 약 개발 생체 자행
143499,콜로설,5.11,12세 관람가,액션 SF 스릴러,나초비가론도,앤해서웨이 제이슨서디키스,뉴욕 남자 남자친구 친구 글로리 직장 고향 무기력 생활 그녀 지구 반대편 대한 대한민국 민국 서울 한복판 거대 괴수 연결 재앙 거 나라 존재 쓸모
148390,콜리션,5.89,청소년 관람불가,공포 스릴러,이윤호,이승준 이익준 김범태,날 돈 유통 정보 입수 태화 동생 마지막 계획 갈취 산장 정수 성진 마 마한 액수 꿈 한나 선영 동근 상현 상현덕분 덕분 의도 밤 술 잠 시체 발견 서로 의심 상황 아무 속고 속이 놈 죽음 그림자 최후 악인 누구인가
127397,콩: 스컬 아일랜드,7.76,12세 관람가,액션 모험 판타지 SF,조던복트로버츠,톰히들스턴 사무엘L.잭슨 브리라슨,전 세계 미지 섬 스컬 아일랜드 날 세상 존재 괴 괴생명체 생명체 모나크팀 위성 무언가 포착 정보 입수 크의 수장 수장이자 이자 탐사 탐사팀 팀 리더 필두 지질 지질학자 학자 생물학자 합류 전투 뼈 베트남 베테랑 베테랑인 인 중령 부 부대원 대원 전직 군인 출신 정글 전문 가이드 반전 사진 사진기자 기자 진짜 목적 작전 동참 폭풍우 도착 앞 왕인 콩 등장 생존자 해골 황무지 적
158094,쿵푸 요가,5.71,12세 관람가,액션 모험 코미디 미스터리,당계례,성룡,저명 고고학 교수 잭성룡 날 인도 아시 아시미타 미 타 박사 고대 보물 지도 이야기 조수 소광 소광레이과 레이 최고 사냥꾼 존 존스리즈팅를 스리 즈팅를 영입 비밀 열쇠 다이 다이아몬드 아몬드 잭 랜 랜달 달 부하 기습 원정 위기
166166,쿵푸마스터,9.38,15세 관람가,액션,펭장리,펭장리,소림사 승려 리롱 차 사고 친형 형수 사망 남 조카 미국 뉴욕 곳 친구 설득 쿵푸 학원 사회복지사 회복 지사 사라 도움 생활 적응 개업 러시아 마피아 돈 어둠 세계 연루 평화 사랑 무술 신성 생각 가족 싸움판
76182,크레이지,7.5,청소년 관람불가,드라마,릭바이버,웨이론페인 알리라터,1945 1945년 내 기타리스트 리스트 행크 랜드 단 번 공연 미국 컨트리 컨트리뮤직 뮤직 심장부 최고 재능 당대 뮤지션 러브 러브콜 콜 이지만음악 음악 자신감 고집 성격 때문 음반사 관계자 프로듀서 갈등 날 시카고 투어 행 매력적 여인 에블린 사랑 그녀 결혼 유명세 외로움 사이 소원 무심 수 실수
166193,크레이지 레이크,4.42,청소년 관람불가,공포,제이슨헨느,리비블랜튼 마르코델베치오 코린도날드슨 롭멜로,여름 휴가 호숫가 오두막 쌍 커플 게임 중 밤 방문자 기척 기척친구 친구 마크 방어 태도 신경 날 날카 카 워 다이 앞 죽음 악몽
160395,크리쳐 빌로우,5.22,청소년 관람불가,공포 SF,스튜어트스파크,안나도슨 데이빗샤클톤 미카엘라롱던 조니비바쉬,해양 생물학자 생물학자이자 이자 잠수 잠수사인 사인 올리브 플래 플래처 처 박사 진행 심해 탐사 연구 참여 경험 잠수과정 과정 괴 생명체 알 부화 처음 발견 신종 지 수 사람 사실 신 초자연 연결 먹이 먹이삼아 삼아 실종 실종사건 사건 수사 중 전모 탈출
130811,클로버,5.96,12세 관람가,멜로/로맨스 코미디,후루사와켄,타케이에미 오쿠라타다요시,특급 호텔 입사 스즈키 사내 모든 여성 선망 대상 상사 츠게 혼 실수 연발 적응력 순수 시련 끝 사람 연인 발전 날 파리 발령 츠 츠것 장거리 연애 시작 새 롤러 롤러코스터 코스터
164986,키드냅,6.65,15세 관람가,액션 스릴러,루이스프리에토,할리베리,아들 눈앞 납치 엄마 카 라 리 베리 유괴범 차 범인 추격 중 경찰서 발견 도움 요청 실종 사건 있음 결심하는데프랭키 수 사람 엄마뿐 뿐 골든 워 12 12시간
150486,키드냅 시티,6.8,15세 관람가,드라마,필립로드리게즈,라라길크리스트 폴리노넌즈,애 조 조나주 나주 피닉스 불법적 국경 이민자 겨냥 인신매매 납치 성행 꿈 미국 땅 영문 채 먼저 사람 방 안 치욕 환경 매일 폭행 자행 2800 달러 지불 곳 수
158488,키드넵 인 루마니아,7.75,청소년 관람불가,드라마,카를로푸스코,마이클매드슨 마이아모건스턴 앤드리아스테판시코바,여행 작가 암 폴 루 루마니아 마니아 취재 중 의문 죽음 묘 이야기 아버지 중 도둑 소지품 길 해매 친구 일행 거기 원한 복수 납치 수 곳 고문
158560,키즈모노가타리 III 냉혈편,8.27,15세 관람가,애니메이션 드라마 액션 판타지,오이시타츠야,카미야히로시 사카모토마아야 사쿠라이타카히로 호리에유이,드라마 드라마츠루 츠 루 에피소드 로틴 로틴커터괴이의 커터 괴 이의 전문가 오시 오시노 노 메 메메 도움 3 3명 명 강적 강적과의 과의 싸움 라 코 미그 흡혈귀 키스 키스샷 샷 아셀롤라 셀 롤 오리온 하트 언더 블레이드 사지 탈환 데 성공 인간 곁 미 존재 본질 수 행동 후회 전말 혼란 앞 친구 츠바사였다하네카와 제안
148946,키코리키: 황금모자의 비밀,7.61,전체 관람가,애니메이션,데니스체르노프,비니펜나 피터린츠 마이크폴락 마크톰슨,무한 무한변신 변신 가능 신비 황금 황금모자 모자 세상 동물 소심 소심양 양 월리 실수 버튼 애벌레 몸 설상가상 최대 위기
124227,킬 유어 프렌즈,6.13,청소년 관람불가,스릴러,오웬해리스,니콜라스홀트 제임스코든,1990 1990년대 년대 영국 브릿 브릿팝 팝 전성기 아티스트 앤 레퍼토리 서로 경쟁 실력 뮤지션 영입 히트 앨범 남 자리 유명 음반 회사 스티븐 스텔 스텔폭스니콜라 폭스 니콜 라 홀트 헤드 수단 방법 못 친구 제임스 코 울분 살해 날 우드 햄 형사 비서 레베카 목
150509,킬러 더 머니,5.4,15세 관람가,범죄 미스터리 스릴러,마틴로제트,켈란루츠 제시윌리엄스 제이미뱀버 제스웨이슬러 루치아게레로,곳 부유 마크 마크켈란 켈 란 루츠 실비아 실비아제스 제스 웨이 부부 친구 숀 숀제시 제시 윌리엄 윌리엄스를 스를 저녁 한다숀 애인 크리스 크리스티나루시아 티나 루시아 레 합세 사람 의문 남자 존 존제이미 제이 미 뱀버 호감 새 이웃 일행 소개 예상 불편 대화 시작 본색
152625,킬러의 보디가드,8.4,15세 관람가,액션 코미디,패트릭휴즈,라이언레이놀즈 사무엘L.잭슨,세상 제일 맛 섭외 1 1순위 순위 앵 보디 보디가드 가드 지명 지명수배 수배 구강 액션 지존 킬러 보호 누 지 안달 난브 난브로맨스 로맨스 제로 환장 미의 링 블록버스터
127374,킹 아서: 제왕의 검,7.78,12세 관람가,액션 모험 드라마 판타지,가이리치,찰리허냄 주드로,마법 인간 공존 세상 권력 눈 보 보티 티 주드 로은 어둠 마법사 결탁 형 왕위 차지 아버지 희생 목숨 구한 서찰 출신 채 거리 아들 성장 한편 보티건의 건의 강압적 정치 핍박 백성 사이 바위 엑스칼리버 자가 왕 소문 힘 검 제거 무리 예언자 멀린 제자 추앙 원정대 삶 본인 운명 수
164290,킹 오브 프리즘 프라이드 더 히어로,9.12,15세 관람가,애니메이션,히시다마사카즈,남도형 엄상현 이원찬,라이브 프리즘 쇼 동경 로즈 입학 치죠 신 그곳 7 7명 명 신입생 미래 프리즘스타 스타 연습 노리 노리즈키 즈 키 진이 슈 슈왈츠로즈 왈츠 음모 해체 위기 몰아넣는다에델로즈 잠정 활동 중단 코 코우지 우지 거액 빚 할리우드 영화 영화음악 음악 제작 카즈키 스트리트 계 초심 히 실력 향상 특훈 돌입 위치 멤버 선배 후배 바통 동료 인연 인연파란 파란 속 프리 즘 킹 컵 개막 개막지금 지금 누 누구도 구도 적 점프 숨 응수 응수킹 오브 왕관 머리 위
126285,킹덤 오브 글래디에이터,3.5,15세 관람가,액션 모험 판타지,스테파노밀라,리로이킨케이드 맷폴린스키 브라이언머피,진 왕국 통합 프 프칸 칸 왕 기간 전쟁 끝 무고 희생자 상실감 악마 승리 유혹 말 조건 미래 울프칸 후계자 목숨울프칸 분노 제안 거절 거래 키 키모크 모크 그로 십 십수 수 후 평화 무술 대회 각지 검 검투사 투사 경기장 참가 왕궁 인과 군 만남 서로 경계 시합 날 인은 예언자 머리 머리건 건 얘기 괴물 수 전설 길
149747,킹스맨: 골든 서클,8.37,청소년 관람불가,액션 모험 코미디,매튜본,콜린퍼스 줄리안무어 태런에저튼,철저 비밀 채 세상 안전 임무 수행 독자적 국제 정보 조직 킹스맨그러 날 국제적 범죄 범죄조직 골든 서클 킹스 킹스맨 맨 본부 파괴 시태 시태런 런 린 린마크 마크 스트롱 최후 규약 발견 위스키 병 미국 켄터키 키워드 곳 형제 스테이츠맨 존재 전 세계 장악 위협적 비지니스 추진 중인 수장 포피 포피줄리안 줄 리 안 무 계획 작전 시작
143487,타이거 레이드,6.44,15세 관람가,드라마,사이먼딕슨,브라이언글리슨 소피아부텔라 데미언몰로니 로리플렉-바이른,데 데이브 이브 고용 용병 페디 사막 이라크 납치 건 수행 파견 작전 진행 신뢰감 충성심 조 회의감 서로 우정 가치관 때문 의심 대상인 여인 뒤 임무 완료 돈 생각 인질 사랑 샤다라 혼란
149501,타임 투게더,8.36,12세 관람가,드라마,마크윌리엄스,제라드버틀러 윌렘대포 그레첸몰 맥스젠킨스,실패 0 성공률 100 헤드 터 폭풍 업무 스트레스 분노 게이지 하늘 쯤 통 전화 아들 라이 라이언 언 데 데인은 인은 암 소식 가족 옆 결심 순간 회사 강요 설상가상 중년 은퇴 재취업 프로젝트 남편 아빠 남자 삶 위기 앞
163081,탄호이저,10.0,청소년 관람불가,공연실황,다니엘바렌보임,페터자이페르트 페터존,음 음유시인이자 유 시인 이자 기사 탄 튀링겐 영주 르 조카딸 엘 엘리 리 베 베트와 트와 사랑 서약 사이 관능 미 여신 베누스 한동안 쾌락 환락 세계 회의 용서 순례 길 순례자 행렬 안 모습 절망 소식 그녀 자리 숨 구원
148643,탐정사무소 - 그놈의 얼굴,6.17,15세 관람가,미스터리 스릴러,이동현,강현중 한그림 유승일 서은서 문주연 이창수,진영 서연 나이 차 극복 결혼 신혼부부 사랑 아내 자살 이유 수 탐정 탐정사무소 사무소 현중에게 조사 원인 내연 내연남 남 연관 거 현 현중 중 진술 무언가 있음 직감 대학 대학동창이자 동창 이자 심리 심리치료사인 치료 사인 진 진희를 희를 최면 전문가 전문가임 임 사건 현중은 중은 설득 당일 추궁 시작 진실
166148,태산쿵푸: 6인의 고수,8.0,12세 관람가,액션 드라마,하지보,,살해 어머니 원한 무림 고수 류 류문호 문호 소의 남자 할아버지 범인 사실 스승 만류 복수 무술 대회 진정 판단 목숨 결심
146469,택시운전사,9.03,15세 관람가,드라마 가족,장훈,송강호 토마스크레취만 유해진 류준열,택시 택시운전사 운전사 만섭 만섭송강호은 송 강호 외국 외국손님 손님 광주 통금 전 월세 수 거금 10 10만원 만 원 말 독일 독일기자 기자 피터 피터토마스 토마스 크레 크레취만를 취만를 영문 채 길 사람 모르 르 우 우덜 덜 택시비 만 기지 검문 위험 서울 만류 대학생 재식 열과 황 황기사유해 기사 유해 도움 속 촬영 상황 집 딸 걱정 초조
163101,탱크: 독일전차군단을 격파하라,5.12,15세 관람가,전쟁 드라마,알렉세이페옥티스토프,보리스클리우예브,2 2차세계대전 차 세계 대전 발발 평범 삶 소련 청년 국가 강제 전쟁터 친구 니콜 니콜라이 라이 표트르 전쟁 실상 충격 거대 독일 탱크 등장 자비 소련군대 군대 시작 선 사실 전우 목숨 적과 맞서기 결심
156497,터널,9.2, , , ,최진혁 윤현민 이유영 조희봉 김병철 강기영 이시아 김민상 양주호 엔 문숙 허성태 이용녀 김동영 함성민 노태엽,30 30년 과거 현재 아재 형사 문물 표류 수사
155484,터닝메카드W: 블랙미러의 부활,8.73,전체 관람가,애니메이션,홍헌표,소연 신용우 윤아영 장광 강호철 안영미 윤미나 엄상현 정재헌,지구 최초 메카 인 디스크 디스크캐논 캐논 완성 무렵지구 트라이 트라이포스 포스 기운 감지 소멸 줄 블랙 블랙미러 미러 복수 부활 것시공 시공 현재 클론 이용 도시 파괴 테이 머 사상 최악 위기 속 최후 배 배틀 틀 준비
140606,테이큰 비긴즈,4.34,15세 관람가,드라마 스릴러,하워드J포드,안젤라딕슨,딸 외국 휴가 싱글 싱글맘 맘 리 중 괴한 납치 그녀 당황 겨를 살인죄 누명 경찰 필사적 정치가 아버지 부탁 외면 도움 고국 지인 무언가 유괴 수
131440,테이킹,6.28,15세 관람가,스릴러 미스터리 공포,애덤로비텔,질라슨 앤램세이 미쉘앙,의대 학생 미아 휴미 미 앙 다큐멘터리 제작자 그녀 친구 알츠하이머 환자 데 데보라 보라 딸 사라 사라앤 앤 램 이의 이야기 제작 건의 집 촬영 거부 돈 필요 필요하다 하다 설득 시작 계속 증상 악화 포악 적 언어 얘기 행동 해 해전 전 살인마 영혼 조종 있음
150371,토니 에드만,8.06,청소년 관람불가,드라마,마렌아데,산드라휠러 페테르시모니슈에크,가족 누 존재 중 나의 아버지 농담 장난 기본 분장 괴짜 인생 재미 커리어 커리어우먼 우먼 딸 드라마
134898,토르: 라그나로크,8.84,12세 관람가,액션 모험 판타지 SF,타이카와이티티,크리스헴스워스 마크러팔로 톰히들스턴 케이트블란쳇,죽음 여신 스가르드 침략 세상 종 나로 나로크의 크의 위기 망치 파괴 토르 져스 동료 헐크와 수 대결 절 절체절명 체 절명
148995,토마스와 친구들: 그레이트 레이스,8.13,전체 관람가,애니메이션 가족,데이비드스토튼,마크모라한 존하슬러,기관 기관차 차 수 전시회 참가 토마스 덩치 전 세계 모인 최고 만큼 수 라도 꾀 내 사장님 유선형 개조 제안 영광 고 인도 마의 모습 감명
148994,토마스와 친구들: 수수께끼 해적선과 보물찾기,7.88,전체 관람가,애니메이션 모험,데이비드스토튼,존하슬러 에디레드메인 올리비아콜맨 존허트 제이미캠벨바우어,개구쟁이 꼬마 기관차 토마스 지선 장난 사고 사장님 혼 새 공사 한창 공사장 번 말썽 구덩이 곳 거대 해적선 발견 뒤 소도 섬 보물 수상 선원 존 보트 스킵 해적 수
169576,토스카,5.0,12세 관람가,공연실황,사이먼래틀,클리드틴오폴라이스 마르첼로알바레스,오페라 가수 토스카 연인 화가 카바 시 정치범 안 안젤 젤 티 짝사랑 경 경감 감 스카 스카르피아 르 피아 남작 의심 자백 강요 고문 사형 협박 몸 허락 대신 사면장 요구 운명 파국
158472,톰과 릴리: 그들만의 공간,8.76,12세 관람가,드라마,제임스최,메릭로빈슨 엘리자베스스텐홀트,160 톰 비만 사회 편견 속 상처 할머니 집 시카고 시골 시골마을 마을 이사 거 생각 뚱뚱보 놀림 세탁소 불량 불량배 배 시각장애인 장애인 릴 릴리 리 앞 당 소녀 릴리덩치 덩치 만큼 청년 약자 공통점 호감 순수 사랑 가게
136889,투 러버스 앤 베어,7.31,청소년 관람불가,드라마 멜로/로맨스,킴누옌,데인드한 타티아나마슬라니,가족 과거로 로만 한 북극 접경 마을 상처 루시 티 마 라니 사랑 날 대학 합격 통지서 새 미래 남쪽 도시 결심 좌절 이별 한편 수 기억 그녀 눈보라 속 마지막 동행 서로 온기 행복
156194,투 이즈 어 패밀리,8.38,12세 관람가,코미디 드라마,위고젤랭,오마사이 글로리아콜스턴,오늘 책임감 0 대책 거 거라 라 허세 사뮈엘 뮈 엘 조 차 여자 척 사뮈엘 애 아빠 말 생후 3 3개월 개월 글로리 새 아기 기저귀 갈기 분유 상황 계속 글로리아만 아만 영국 영국행 행 비행기 결국무일푼 무일푼 베 베르 르 니 도움 런던 딸 삶 시작 하면서누 누 수 싱글 대 대디 디 웃픈 육아 라이프
165846,툼디:부러진 검의 전설,6.77,15세 관람가,액션,빈분루에릿,부아카오포프라묵 푸다릿프롬반달,태국 전설적 영웅 프라 피 피차이 차이 일대기 영화
