54304,와와의 학교 가는 날,9.14,전체 관람가,드라마,펑천,딩지아리 아나무랑 조희문,중국 고도 윈난성 고산 고산지대 지대 우애 남매 나샹 학교 길 누 누강 강 협곡 사이 외줄 짚 짚라인 라인 뿐 등굣길 동선 엄마 누나 허락 동생 이유 통학 금지령 매일 날 결심 문화 충격 선생님 친구 공부 기한 뒤 도둑 수업 시작 본의 유식 뻔 가기 프로젝트 수 세상 사랑 꿈
143212,완소녀 쟁취기 2,5.5,청소년 관람불가,코미디,카를로스테론,아드리안라스트라,얼굴 바디 바디라인 라인 그녀 최고 엘리트 하버드 소녀 사라 알 알폰소 폰 소 친구 거짓 학적부 하버드대 대 위장 입학 사랑 쟁취 라면 못 가짜 하버드생 생 황 캠퍼스 로맨스 시작
143624,왕초와 용가리,8.42,15세 관람가,다큐멘터리,이창준,상현 정선 복수 진태,거대 타임 타임스퀘어 스퀘어 자리 화려 영등포 뒷골목 별종 중 만 안동네 21 21세기 세기 왕초 거리 하루 일과 시작 큰형 상현 평화 질서 손 사람 하루하루 웃음 이웃 가족 생존 속 사연 오해 뻔 그곳 얼굴 웃음가식 식 진짜 삶 이야기
154102,외박: 친구의 여자,6.62,청소년 관람불가,멜로/로맨스,유승택,김원일 이시안 서한,절 건우 태 태철 철 사이 여자 문제 만 입장 밤 10 10년 간 짝사랑 그녀 영과 하룻밤 가지 영이 사랑 사실 세영 마음 생각 수록 발견
145693,외인부대: 암살자들,2.8,15세 관람가,액션 모험,크리스토퍼레이,브리짓닐슨 비비카A.폭스 조벨 크리스타나로컨 신시아로즈록,정예 특수 특수요원 요원 암살 암살작전 작전 그녀 살인 살인본능 본능 아버지 선거 대통령 딸 홍보 차 내전 황폐 황폐해진 해진 카자흐 카자흐스탄 스탄 방문 산악 지대 도중 민병대 습격 납치 최악 상황 발생 주도 군벌 수장 울 미국 목숨 미끼 백악관 협박 미 정부 팀 결성 잠입 실시 킬러 임무 완수 수
99675,요노스케 이야기,9.09,12세 관람가,드라마,오키타슈이치,코라켄고 이케마츠소스케 요시타카유리코,일본 큐 큐슈 슈 지방 출신 요 요노스케 노스케 도쿄 대학 진학 마음 상경 입학 후 다양 친구 4 4년간 간 대학시절 시절 마감 사회 입성 생활 속 새내기 미소 동아리 활동 표정 행방 아무 적인 우정 지금
145141,욕망의 젊은 도우미,3.75,청소년 관람불가,에로,쿠도마사노리,호시노아카리 사야마아이 사카이아즈사,청소 여배우 처절 몸부림 청소업체 업체 운영 꿈 도모 도모미 미 배우 계기 그녀 현실 회의 톱 타로 손 게 게타로 내연 내연녀 녀 리 살해 아내 마리 살인죄 살인마 단둘 저택 남 운명
20363,용문객잔,7.79,15세 관람가,액션,호금전,석준 백응,명나라 말기 궁 궁정의 정의 실세 환관 세력 충신 우 우겸 겸 처형 후손 용문 밖 추방 암살 자객 검객 사실 우겸의 겸의 객 객잔 잔 최후 결전 준비 복원 복원판 판 호 호금전 금전 걸작
151670,우리 갑순이,7.6,15세 관람가, , ,김소은 송재림,시대 결혼 부부 삶 긍정적 가족 드라마
149955,우리 손자 베스트,7.23,청소년 관람불가,드라마 코미디,김수현,구교환 동방우 김상현,취업 연애 인간 인간관계 관계 공부 뭐 조선 20 20대 대 백 백수 수 교환 교환구교환 아무것 유일 수 곳 키 키보드 보드 보금자리 베스트 활동 중 온종일 나라 걱정 할아버지 정수 탑 탑골공원 골 공원 종로 뒷골목 좌파 좌파척결 척결 국가 국가부흥 부흥 70 70대 애국 애국노인 노인 정수동방우 동방 우 애국심 자랑 어버이 어버이별동대 별동대 대장 예전 한탄 종일 매국 매국노인 듯 청년 열혈 회원 시작 특별 사랑
134987,우리 연애의 이력,7.96,15세 관람가,멜로/로맨스,조성은,전혜빈 신민철,재기 여배우 연 영화 감독 만년 조연출 선재 사랑 종지부 성숙 동료 동료이자 이자 친구 관계 유지 충무 커플 등극 공동 시나리오 작업 돌입 사람 탄생 수 기회 순간 예상 위기 이별 끝 해피엔딩
149582,우리 지금 할래,6.0,청소년 관람불가,멜로/로맨스,박범수,수지,무인도 섬 남자 여자 수희 사랑 정신 복 복순 순 명 날 무언가 비밀 간직 사진작가 방문객 오해 복순은 순은 죽음 자살 사람 이야기 나중
151650,우리 집에 사는 남자,8.88,15세 관람가, ,김정민,수애 김영광 이수혁 조보아,아빠 우기 남자 가족 간의 우여곡절 드라마
146504,우리들  ,9.27,전체 관람가,드라마,윤가은,최수인 설혜인 이서연 강민준,여름 친구 내 마음 외톨이 선 교실 방학 방학식 식 날 전 전학생 학생 서로 비밀 순식간 세상 사이 선과 생애 개학 후 학교 만난 얼굴 보라 편 외면 관계 회복 노력 폭로 수
127079,우리친구 피들스틱스,8.69,전체 관람가,가족 코미디,바이트헬머,벤노퓨어만 프리치하벌란트 페터부다크 노라뵈르너 헨리에테크라톡흐뷜 샬로테뢰비히 미오마티스봐이제 저스틴뷜케,평화 웠 볼 볼러스 러스 마을 날 소비자 연구회 연구회사인 사인 유럽 중심 위치 이유 하나만 만 평균 선정 혁신적 신제품 테스트 어른 정책적 최선 결과 반려 반려동물 동물 금지 연령 나이 노인 꼬마 수 반발 대표 져스 져스급 급 악동 리 막스 레 주제 파울 최고 친구 코너 코너구리 구리 피 스틱스 할머니 할아버지 구출 기상천외 상상력 발휘 수호 프로젝트
150723,우미인초,0.0,15세 관람가,드라마,미조구치겐지,,사요 사요코 코 아버지 거둔 오노 결혼 약속 학업 때문 사람 고 노가 장남 출세 금전 별 관심 계모 딸 후지 생각 가지 방법 모색 이복 오빠 고의 친구 친구이자 이자 예비 외교관 무 치 치카 카 정혼 사이다 후지오 모녀 성에 영어 선생 계획 핑계 확답 파혼 선언 일본 문호 나쓰메 소세키 번째 신문 신문연재소설 연재 소설 각색
153408,우연히 만난 내 소꿉친구,6.5,청소년 관람불가,에로,카츠라기히로후미,아리무카치카,대학생 지붕 아래 쇼 쇼타 타 동거 동거중 중 주변 주변사람 사람 관계 이해 시선 개의 삶 먼저 생각 여자 여자친구 친구 친구사이 사이 변화
142641,우주의 크리스마스,7.23,15세 관람가,드라마 판타지,김경형,김지수 허이재,꿈 간직 서른 서른여덟 성 성우주 우주 미련 과거 열 열아홉 스물 스물여섯 사랑 수 남자 가슴 켠 흔적 과거이자 이자 현재 그녀 명 기적 시작 서로 미래 세 명의 여자 성우 성우주세 주세 희망 미라 드라마
112022,우주전쟁: 지구대침공,4.86,12세 관람가,SF 전쟁,썬더레빈,아드리안폴 리차드그리에코,외계인 공격 지구 멸망 위기 일부 인간 우주선 탈출 시도 원인 충돌 외 행성 불시착 투명 형태 카멜레온 대적 계획 희생자 마지막 희망 끝
73442,우주전쟁: 화성을 지켜라,4.95,15세 관람가,SF 스릴러 전쟁,마크앳킨스,안토니오사바토주니어 트레이시로즈,적진 잠입 비밀 작전 수행 존 카 카터안토니오 터 안 토니오 사바 사바토 토 주니어 적의 총 중상 국군 국군병원 병원 치료 군 비밀리 진행 실험 강제 동원 카터 시 시공간 공간 이동 도착 곳 외계 종족 간의 전쟁 계속 화성 군의 특별 능력 간 거대 새 운명
146914,욱씨남정기,9.47,15세 관람가, ,이형민,이요원 윤상현,갑 갑질의 질의 시대 고군 고군분투기 분 투기 드라마
149125,운빨로맨스,9.16,15세 관람가, ,김경희,황정음 류준열 이청아 이수혁,운명 미신 맹신 심 심보늬 보늬 수학과 과학 공대 출신 게임 게임회사 회사 수호 로맨틱 코미디 동명 웹 웹툰 툰 운 로맨스 재치 장점 드라마 해석 작품
138575,울보,8.13,청소년 관람불가,드라마,이진우,장유상 하윤경 이서준,숫기 내성적 성격 이섭 전학 전학간 간 학교 문제아 하윤 윤 짝 수업 수업시간 잠 공부 관심 관찰 호기심 중 서로 하윤 동네 양아치 리더 격 길 길수 수 수 사람 세상
91891,울트라맨 제로: 베리알 은하제국,10.0,전체 관람가,SF 액션 모험,아베유이치,코야나기유,울트라 울트라맨 맨 제로 전설적 역대 악의 베리 베리알과 알과 괴수 군단 서 승리 쟁취 베리알 알 평행 우주 속 은하 은하황제 황제 카이저 부활 전사 복수심 국군 앞 전 은하계 손아귀 시무 시무시한 시한 계획 이제 카이저 은하제국 제국 필살 대 대전쟁 전쟁
154345,울프라이징,7.5,15세 관람가,공포,BC퍼트니,브라이언베리 맷캅코 멜리사카넬,알코올 중독 치료 중인 엠 엠마 마 계속적 악몽 아칸소 시골 고향 고향마을 마을 한편 교도소 죄수 2 2명 명 탈옥 사건 발생 그중 명이 늑대 공격 늑대인간 인간 후 도망 엠마가 마가 지역 사랑 사람 살해
127136,울프캅,6.76,청소년 관람불가,코미디 공포,로웰딘,레오페펄드 에이미마티시오 사라린드,전직 경찰 아버지 의문 사고 후 루 정도 음주 무 폐인 폐인생활 생활 날 오컬트 의식 신고 출동 악당 기습 가슴 별 모양 흉터 이후 보름달 사람 허물 늑대 늑대인간 인간 변신 변화 모습 비밀 사건 연관 경찰관 복수 예전 수
145319,웅덩이의 두 사람,10.0,청소년 관람불가, ,호리이히카루,산단토모아키,다나 다나코 코 애인 영화학 친구 아키라 맘 속 필름 편집 중 선 유혹 날 술 그녀 모텔 주고 2 2주 주 후 결혼 마음 정리 채 사랑 이혼 말 연락 상처
148507,워리 돌스,1.67,청소년 관람불가,공포 스릴러,패드레이그레이놀즈,크리스토퍼위엘 킴잭슨,연쇄 연쇄살인범 살인범 헨리 수사 형사 맷 소지품 중 주술 인형 발견 딸 클로에 액세서리 사람 의문 분노 분노감 감 살인 원인 병 고통 중 주술인형 비밀
75006,워크래프트: 전쟁의 서막,8.66,12세 관람가,액션 모험 판타지,던칸존스,트래비스핌멜 벤포스터 폴라패튼 도미닉쿠퍼 클랜시브라운 토비켑벨,개 운명 세계 세계공존 공존 차원 인간과 오크 행성 황폐 시작 인간 왕국 건설 생존 서로 도움 필요 필요하다 하다 종족 영웅 듀 탄 반대 세력 분열 진영 혼란 세상 피 수 전쟁
146980,워킹 맘 육아 대디,10.0,15세 관람가, ,최이섭,홍은희 박건형 오정연 한지상 신은정 공정환,출산 강요 뿐 방법 고민 세상 부모 육아 육아전쟁백서 전쟁 백서 드라마
126059,워킹 위드 더 데드,5.62,청소년 관람불가,코미디,스콧도우,팀오글트리 조이오글스비 데이브셔리단 트로이오글트리,아들 야구공 혼수상태 보안관 링 홀 병원 그곳 그린 그린베이 베이 시카고 생존자 쇼핑몰 합류 제안 가족 크리스 운영 클럽 사랑 아내 바 바비 비 비들 공격 안전 안전하다 하다 생각 좀비 위협 일행 발견 은신처
146501,원 밀리언 킥,6.0,15세 관람가,액션,알렉스패드루,마틴바덴 마이클본허터,돈벌이 건수 사업가 눈 싸움 고수 마이크 언더 언더그라운드 그라운드 격투 토너먼트 참가 인터넷 중계 팬 열광 화제 주인공 급부상 예상 격전 끝 부상 입 병원 가게 우연 계기 스승 음모 인생 마지막 결투 준비
141060,원나잇스캔들:모닝애프터,9.0,청소년 관람불가,코미디 드라마,산라J켈,미쉘롬바도 바네사에비건 벤에슬러 캐머런제보,하룻밤 원 원나잇 나잇 욕 욕망 망 8 8가지 가지 스탠드 스탠드다음 날 아침 당 당신은 신은 번 모닝 모닝섹스 섹스 머 여자 내가 사랑 가능 잇과 다음날 시츄에이션
146514,원더미어 부인의 부채,0.0,12세 관람가,코미디,에른스트루비치,로널드콜먼 메이맥애보이,부인 사교계 명성 그녀 금전 도움 윈 윈더미 더미 경이 아내 생일 생일파티 파티 초대 사람 사이 의심 수 남편 갈망 달링턴 경 가기 결심 설득 실수 집 부채 아일랜드 출신 작가 오스카 와일드 대표 희곡 작품
150126,원티드,9.4,15세 관람가, ,박용순,김아중 지현우 엄태웅,국내 최고 여배우 납치 아들 생방송 리얼리티 쇼 범인 요구 미션 수행 고군 고군분투기 분 투기 스릴러 드라마
146214,원피스 필름 골드,8.92,12세 관람가,애니메이션 모험 판타지 액션,미야모토히로아키,타나카마유미 나카이카즈야 오카무라아케미 야마구치캇페이 히라타히로아키 오오타니이쿠에 야마구치유리코 야오카즈키 야마지카즈히로 쵸,세계 정부 절대 성역 성역이자밤낮 이자 밤낮 쇼 최대 엔터테인먼트 도시 테 테소로 소로 도착 루피 밀짚모자 해적단 주인 주인이자 골드 골드골드 열매 능력자 길드 준비 승자 패자 패자간 간 비정 룰 존재 게임 참여 동료 자유 운명 베팅 시작
150100,월계수 양복점 신사들,6.75,15세 관람가, ,황인혁,이동건 조윤희 신구 김영애 차인표 라미란,역사 전통 자랑 맞춤 맞춤양복점 양복점 월계수 배경 사연 남자 눈물 우정 성공 사랑 드라마
84807,월드워2: 나치의 침공,3.19,청소년 관람불가,액션 코미디 모험 공포 판타지,우베볼,나타샤말드 클린트하워드,2 2차 차 세계 세계대전 대전 나치 나치군 군 비밀리 뱀파이어 연구 불로 불로불사 불사 군대 최종 최종병기 병기 진실 사냥꾼 레인 지역 반란군 군단 결심
117803,월터 교수의 마지막 강의,7.87,청소년 관람불가,드라마,팀블레이크넬슨,샘워터스톤 크리스틴스튜어트 그레첸몰 글렌클로즈 코리스톨 팀블레이크넬슨,뉴욕 콜롬비아 대학원 철학 공부 중인 소피 소피크리스 크리스 스튜 사람 삶 도움 사고 사고다운 다운 불가능 시대 틈 소통 회의감 그녀 위안 수 월터 터 교수 교수샘 샘 워터 워터스톤 스톤 유일 유일하다 하다 30 30년 교단 남 인생 본인 은퇴 결심 마지막 강연 날 아내 꽃 포장 집 사건
150603,웨포나이즈드,4.55,청소년 관람불가,SF 액션 스릴러,티모시우드워드주니어,미키루크 톰시즈모어 조니메스너 테일러콜 티모시우드워드주니어,2017 2017년 7 7월 4 4일 국방부 건물 펜타곤 테러리스트 공격 무고 인명 희생 그로 1 1년 후 시내 호텔 로비 총기 난사 사건 발생 용의 용의자로 자로 이라크 파병 제대 잭 사이먼 현장 체포 총 기억 주장 죄 인정 행동 미 형사 진술 앞뒤 의심 치의 상사 기관 수사 의문 피터슨 교수 전화 비밀리 답 파일
145395,위기의 유부녀: 남편과는 다른 맛,0.0,청소년 관람불가, ,토모마츠나오유키,사쿠라다사쿠라 카자마교코,권태기 스와핑 시도 부부 아내 상대 정성 애무 남편 욕망 밤 절정 질투
136687,위대한 소원,7.91,15세 관람가,코미디 드라마,남대중,류덕환 김동영 안재홍 전노민 전미선,전 번 ㅅ ㅅㅅ 꿈나무 환 상 상남자 남자 남 남준매 준매 금 금수저 수저 갑 갑덕 덕 시한 시한부 부 선고 고환 마지막 소원 달 내일 어른 절 녀석 고군 고군분투 분투 시작 인정 사정 필요 녀석 혈기 혈기왕성 왕성 코미디
127333,위스키 탱고 폭스트롯,7.46,15세 관람가,코미디 전쟁,글렌피카라,티나페이 마고로비 마틴프리먼,방송국 특종 자리 자리걱정 걱정 던 티나 페 프 니스 종군 기자 기자직 직 지원 결정 현지 도착 그녀 초 티 바 그곳 타 로비 전쟁터 종군기자 노하우 전수 남자 내 꺼 매력 산전수전 집 침대 양 편안 안이 순간 이제 전쟁 세상
140647,위자 : 저주의 시작,7.14,12세 관람가,공포,마이크플래너건,엘리자베스리저 애너리즈바쏘 룰루윌슨 헨리토마스,1967 1967년 교외 마을 의뢰인 연결 심령 심령사기 사기 앨리스 딸 리 도리스 새 도구 위자 보드 사용 절대 게임 룰 막내딸 집 안 악령 상상치 공포
147936,위켄즈,9.07,15세 관람가,다큐멘터리,이동하,지보이스 재우 샌더 민 철호 재경 종걸 기환 남웅,사랑 주말 창단 10 10주년 주년 국내 최초 게이 게이코러스 코러스 살의 신입 신입단원 단원 중년 창단멤버 멤버 환경 가치관 공통점 노래 점 외 서로 사이 앞 기념 공연 행사 처음 위기 처 처럼 럼 행복 수
127390,위풍당당 질리 홉킨스,8.39,전체 관람가,코미디 드라마 가족,스티븐헤렉,소피넬리스 캐시베이츠 글렌클로즈 옥타비아스펜서 줄리아스타일스,세 친엄마 질 질리 리 홉킨스 홉킨스소피 소피 넬리스 상처 상처투 투 위로 보호 위탁 가정 전전 그녀 새 보호자 트로 트로터 터 아줌마 아줌마캐시 캐시 베이츠 진정 가족 의미 날 앞 처음 외할머니 외할머니글렌 글 렌 클로즈 인생 변화 가을 메시지 이야기 시작
149625,위험한 섹스: 아야노의 불륜,6.0,청소년 관람불가,에로,토모마츠나오유키,코토노 우사기츠바사,노 망상 망상학교 학교 선배 남편 졸업 후 결혼 직장 직장생활 생활 경험 매일 밤 무심 때문 자위 욕정 사업 실패 상사 잠 잠자리 자리 사랑 날 영업 방문 집 집이상 기운 여자 손 신경 사이 사이죠를 죠를 수록 주변 질투 얼굴 아내 뉴스 토막 토막살인 살인 한눈 혼령 직장동료 동료 말 그녀
145404,유리의 꽃과 부수는 세계,8.03,12세 관람가,애니메이션 SF 판타지,이시하마마사시,하나모리유미리 타네다리사 사쿠라아야네 카야노아이,빛 형형색색 무중력 공간 지식 상자 그곳 가지 세계 사람 날 듀얼 도로 도로시 시 침식 존재 바이러스 출현 감지 공격 소녀 리 리모 발견 그녀 기억 채 마디 꽃밭 해
147349,유부녀들:쾌락 스와핑,0.0,청소년 관람불가,드라마 멜로/로맨스,카츠야마시게오,무라타마키코,행복 신혼 신도시 이사 미 코 남편 권태기 해결 스와핑 스와핑모임 모임 참가 그곳 부부 선 거부 수 쾌락 모습 혼란 타락 늪
139438,유스  ,8.34,15세 관람가,드라마,파올로소렌티노,마이클케인 하비케이틀 레이첼와이즈 폴다노 제인폰다,은퇴 선언 세계적 지휘자 프레드 밸린저 휴가 스위스 고급 호텔 친구 친구이자 이자 노장 감독인 믹 스탭 영화 각본 작업 매진 의욕 산책 마사지 건강 건강체크 체크 무료 영국 여왕 대표곡 심플 송 연주 특별 요청 무대 거절
136201,유아 어글리 투,7.36,12세 관람가,드라마 가족,마크누난,에이단길렌 로렌킨셀라 에리카상떼,중 중2병 2 병 중년 중년병 삼촌 윌 에이 길 길렌중년병 렌 조카 스테이 스테이시 시 로렌 누나 죽음 남 가석방 윌스테이시 추억 캠핑 캠핑장 장 이상한 이상한가요스테이시의 가요 시의 전학 문제 일자리 이웃 사람 다가 노력 스테이시서로 서로 존재 츤 츤데레 데 레 가족 이야기 시작
158269,음란 선비,4.71,청소년 관람불가,멜로/로맨스,최우성,오주하 민주 김영준,조선 조선시대 시대 최고 난봉꾼 박용 박용주 주 여자 바람 위기 용주 하늘 자유 세상 순간 21 21세기 세기 타임 슬립 그곳 생각 꿈 환락 물건 물건인고음란 인고 음란 천국
154622,음식탐정,9.0,전체 관람가, , ,조세호 박지윤,제한 단서 조리 조리서 서 속 음식 형태 추리 재현 팀 우승 프로그램
153525,음탕한 아내: 남자의 맛,0.0,청소년 관람불가,에로,카츠라기히로후미,야마모토미와코 카노아야코,대학 동기 모임 나간 게이코 게이코야마모토 야마 모토 미 코 분 한때 연인 사이 히 하세 키 분가 변호사 감정 귀가 그녀 남편 출장 핑계 회사 부하 여직원 유 유카리카노 카리카 노 바람 외도 의심 탐정 뒷조사 부탁 날 외로움 만난 술기운 서로 사랑 확인 며칠 뒤 불륜 현장 사진 친구 탐정미 미 역과 술 후 몸 허락
137349,이니시에이션 러브,7.74,12세 관람가,멜로/로맨스,츠츠미유키히코,마츠다쇼타 마에다아츠코 키무라후미노 미우라타카히로,80 80년대 년대 후반 수줍음 순수 모태 모태솔로 솔로 대학생 스즈키 나간 미팅 사랑 여학생 마유 눈 그녀 남자 노력 세상 연인 한 도쿄 취직 시작 주말 마 유 곳 몸 마음 설상가상 매력적 동료 미 코 비교 첫사랑 불이
125434,이레셔널 맨,7.81,청소년 관람불가,미스터리,우디앨런,호아킨피닉스 엠마스톤 파커포시 제이미블랙리,생기 매혹적 철학과 학생 질 전임 온 교수 이브 강한 독창적 사상 달변가 현실 삶 염증 있다에이브 고통 감성 로맨틱 환상 자극 마력 서로 호감 생의 의지 오리무중 날 식당 부도덕 판사 이야기 심장 심장마비 마비 순간 감각 남 사랑 활력 며칠 후 조깅 중 사망 다이 시골 마을 미스터리 소문 시작
151685,"이번 주, 아내가 바람을 핍니다",9.06,15세 관람가, ,김석윤,이선균 송지효 이상엽 보아 김희원 예지원,남편 아내 불륜 뒤 익명 사람 교감 내용 드라마
150072,이웃사이다,0.0,전체 관람가, , ,박수홍 윤정수 김종민 홍윤화 이혜정,이웃 갈등 해결 게임 미션 서로 이해 신뢰 과정 프로그램
139452,이중섭의 아내,7.22,전체 관람가,다큐멘터리,사카이아츠코,야마모토마사코 야마모토야스나리,1941 1941년 야마 야마모토 모토 마사코 재학 중이 문화 문화학원 학원 복도 붓 선배 이중섭 사랑 이후 1945 1945년 3 3월 2 2차 차 세계 세계대전 대전 한창 중섭 한국 해 5 5월 지금 북한 북한땅 땅 원산 전통 전통혼례 혼례 부부 행복 시절 625 전쟁 가난 건강 악화 일본 가족 그리움 편지 대신 전달 살 꿈 채 죽음 2013 2013년 90 90세 세 아내 휠체어 여행 평생 그림 황소 앞 중섭과 곁 내 기쁨 그대 그립 그립소사랑 소사랑 사랑하오 하오 중
78384,이지머니,6.1,청소년 관람불가,범죄 드라마 스릴러 액션,다니엘에스피노사,조엘킨나만 마티아스바레라 드라고미르므르시치,신분 상승 가난 대학생 조 재 재별 별 3 3세 세 가장 상류층 친구 금전 한계 돈 라면 수단 방법 짓 마피아 조직 발 극악 어둠 세계 재벌 세상 이중 생활 날 눈 보스 사업 방해 모조 위험 임무 목숨 일각 선 죽기 전
99829,이지머니 2,7.5,청소년 관람불가,액션 범죄 드라마 스릴러,바박나자피,조엘킨나만 마티아스바레라 페레스파레스,마약 거래 교도소 조 모범수 가석방 인생 전과자 신분 무리 마피아 조직 돈 눈 비자금 행방 일행 추격 시작
115717,이지머니 3,7.08,청소년 관람불가,범죄 드라마 스릴러,얀스욘손,조엘킨나만 마티아스바레라,최강 액션 블록버스터 완성 스웨덴 역 역사상 사상 은행 은행털이 털이 계획 마피아 조직 경찰 위험 잠 잠입수사가 입수 사가 진행 한편 은둔 조직원 조 전 누나 카 중 그녀 범죄 조직단과 단과 연계 사실 어둠 세계
127361,이퀄스,8.3,15세 관람가,드라마 SF,드레이크도리머스,크리스틴스튜어트 니콜라스홀트,감정 통제 사랑 사랑만이 만이 유일한 범죄 감정통제구역 구역 날 동료 죽음 목격 콜 콜라스 라스 홀 현장 니 아크 아크리스 리스 스튜어트 표정 변화 그녀 감정보균자임 보균자 임 기억 관찰 생전 처음 억제 치료 향 마음 사일 사일러스 러스 서로 확인 뜻 위기 사람 탈출 결심
131294,이트,6.35,청소년 관람불가,드라마 공포 스릴러,지미웨버,매기머독 알리프랜시스 제레미메이크,30 30대 대 배우 지망생 노벨라 매클루 클루 3 3년 시도 남성 좌절 저축 재산 바닥 월세 월세집 집 직전 스트레스 손 시작 친절 집주인 이샤 친구 캔디스 살 증상 지기 치료 만난 정신과 의사 사이먼 마음 영화 제작사 출연 제안 그녀
136325,익스트림 타겟,3.21,15세 관람가,액션,데이비드R로사다,우나이가르시아 미리암까베자,동거 남친 알바 집 두고 회사 동료 동료이자 이자 연인 사이 사이인 인 호 호르 르 출장 길 계속 문자 신경 짜증 말다툼 도중 주유소 기름 곳 계산 보니 가게 사람 수 총알 방 방총 총 킬러 이후 도움 요청 침묵 죽음 덫 쥐 남자 지옥 방법 하나뿐 뿐
55009,익스트림 터미네이터 TR,5.4,15세 관람가,액션 SF,자비에S펄스로스키,제레미런던 에이마르티네즈,우주 우주기지 기지 본부 보상 특별 보급품 대신 로봇 화물 배달 당황 선장 내부 목록 확인 확인하라 하라 지시 돌변 명령 무시 살해 인간 복종 중앙 보안 시스템 상황 한편 수백 대 수송선 누군가 조종 지구 발견 점령 뒤 길거리 인류 무차별 공격 시작 보안관 관 리드 포함 일행 영문 채 과의 필사적 싸움
