142266,그대 이름은 장미,6.76,12세 관람가,코미디,조석현,유호정 박성웅 오정세 하연수 이원근 최우식 채수빈,딸 겐 잔소리 1 1등 선 오지랖 대한 대한민국 민국 평범 엄마 홍 홍장미씨우연 장미 씨 우연 사고 과거 남자 명환 평온 일상 설상가상 그녀 들통 들통날 날 위기 20 20년 남 남사친 사친 순철 강제 강제과거소환 소환 애 시작 홍장미 수 반전 반전과거 영원 비밀
167616,그때 그들,7.24,청소년 관람불가,드라마 코미디,파올로소렌티노,토니세르빌로 리카르도스카마르치오 엘레나소피아리치,재계 서열 1 1위 위 미디어 장악 구단주 망언 제조기 이탈리아 현혹 최악 이슈 메이커 실비 실비오 베 루스 루스코 코 정치 스캔들 연루 총리직 사퇴 뒤 뒤재기 재기 발판 마련 개인 별장 연예 기획자 세 세르 르 모라 니 권력 인생 역전 접근 성공 욕망 남자 목적 수단 방법 폭주
172858,그레이브 하우스,4.5,15세 관람가,드라마 스릴러 공포,안톤시규르드손,비욘흘리뉘르하랄드손 엘바마리아비르기스도티르 마르그레트아스타 니나독필립푸스도티르,재력 사랑 딸 손 손야 부부 날 회사 파산 세계 새 시작 란드 시골 저택 휴가 페를라라 소녀 입양 평화 남 남편 편 페를라 유령 감지 아내 사람 운명 나의 눈 진실
171539,그린 북,9.59,12세 관람가,드라마,피터패럴리,비고모텐슨 마허샬라알리,1962 1962년 미국 입담 주먹 토 발레 발레롱 롱 비고 터 교양 우 우아함 아함 자체 천재 피아니스트 돈 셜 셜리마허 리 마 박사 운전기사 면접 백악관 초청 전역 콘서트 요청 명성 셜리 위험 남부 투어 공연 결심 기간 보디가드 겸 고용 인생 발레롱가 기품 박사생각 생각 행동 말투 취향 사람 여행 여행안내서 안내서 그린 그린북 북 의존 특별 시작
181542,그림자 킬러,8.0,15세 관람가,스릴러,앤드류루모어,알란헌팅턴,여성 그림자 스토커 순식간 살해 이후 죽음 고속도로 배경 공포 에피소드 차례 소개 싸이코 살인마 다중 다중인격자 인격자 정체 원혼 복수 흡혈 흡혈귀의 귀의 사냥터 탈주범 배신 다양 소재 하이웨이
180372,극장판 공룡메카드: 타이니소어의 섬,9.14,전체 관람가,애니메이션,최신규,김서영 엄상현 안현서 김장,옛날 소행성 충돌 지구의 공룡 사람 섬 모습 타 소 소어로 어로 탄생 트리 라 장난꾸러기 노 잠 잠꾸러기 꾸러기 스테 소어 친구 도토리 축구 나날 중 중수상 수상 악당 평화로운 소어의 어의 위협 시작 눈빛 정체 위기 지상 낙원 수
185913,극장판 반지의 비밀일기,9.06,전체 관람가,애니메이션,한승우,방연지 김선혜 조경이 채민지,요즘 비가 날 방울 소리 친구 시작 아빠 베 베프 프 응심 냠냠이 미스터리 빵 장수 순식간에 세계 아이스 아이스크림 크림 동산 초콜릿 동굴 슈크림 마왕 바게트 병사 수상
185925,극장판 샤이닝스타:새로운 루나퀸의 탄생!,9.09,전체 관람가,애니메이션,박일호,정혜원 이명호 박리나 이지현,세계 최고 아이돌 돌 학교 샤이닝 샤이닝스타 스타 스쿨 스쿨데뷔반 데뷔 반 완성 연습 헤라 노력 노력형 형 나라 타이틀 루나퀸 오디션 돌입 중 속한 그룹 돌스 탈퇴 합류 새 팀 뉴 멜로디 결성 실력 실력지상주의 지상주의 이사장 칼리오페 솔로 루 퀸 결승 무대 단독 우승 수 우정 시작
183783,극장판 엉덩이 탐정: 화려한 사건 수첩,4.0,전체 관람가,애니메이션,히라야마미호,김은아 소연,평화 오후 찻집 엉덩이 탐정 조수 브라운 티타임 쇼핑백 뿌우람 씨 마을 오픈 카레 가게 사장 요리 중요 향신료 수 충격 추리 수수께끼 보라 부인 암호 사건
183113,극장판 오소마츠 6쌍둥이,9.02,15세 관람가,애니메이션 코미디,후지타요이치,신용우 권창욱 이호산 황창영 최승훈 김혜성,날 고등 고등학교 학교 동창회 오소마츠 소마 츠 6 6쌍둥이 쌍둥이 제대 어른 성장 사회인 활동 동급생 비교 현실 의기소침 홧김 술 잠 다음날 아침 눈 형제 무언가 평소 풍경 발견 과거 순간 6명 명 중 시절 후회 사람 말 진실 확인 18 18살의 살의
188345,극장판 타오르지마 버스터 - 블랙어썰트의 귀환,9.56,전체 관람가,애니메이션 코미디 액션 모험,조영광,홍범기 안효민 안영미,평화 지구 생활 날 우주 용병 회사 긴급 소환 명령 명령우주 팀 운명 대결 시작 한편 전설 블랙어썰트 우주해적단과 해적 단과 버스터 피 수 격돌
187366,극장판 헬로카봇 : 달나라를 구해줘!,7.51,전체 관람가,애니메이션,최신규,이지현 김용준 양정화 조경이,평화 웠 지구 타워 타워크레인 크레인 우주 우주정거장 정거장 달의 뒷면 토끼 토끼족 족 마을 외계 로봇 공격 위기 정복 외계인 것평화 수호 차탄 카봇들 달 혼란 군단 달나라 카봇 지상 지상최대 최대 연합 연합작전 작전 시작
181554,극장판 헬로카봇:옴파로스 섬의 비밀,8.74,전체 관람가,애니메이션,최신규,이지현 김용준,남 남태평양 태평양 휴가 차탄 가족 친구 섬 표류 그곳 지구 배꼽 생명력 신비 옴 옴파로스 파 로스 슈퍼 슈퍼연료전지 연료 전지 구공탄 외계 로봇 공격 위기 온난화 세상 정복 외계인 동물카봇 운명 대결 시작
167651,극한직업,8.5,15세 관람가,코미디,이병헌,류승룡 이하늬 진선규 이동휘 공명,철 철주야 주야 실적 바닥 해체 위기 마약 마약반 반 곳 팀 맏형 고 고반장 반장 국제 범죄 범죄조직 조직 국내 밀 밀반입 반입 정황 포착 장 장형사 형사 마 마형사 영호 재 재훈 훈 4 4명 명 팀원 잠복 수사 24 24시간 감시 아지트 앞 치킨 치킨집 집 인수 위장 창업 뜻밖 절대 절대미각 미각 숨 재능 맛 맛집 입 입소문 소문 시작 뒷전 치킨장사 장사 눈코 새 날 절호 기회 범인 닭
163826,글래스,7.41,15세 관람가,드라마 미스터리 SF 스릴러,M나이트샤말란,제임스맥어보이 브루스윌리스 사무엘L.잭슨 안야테일러조이 사라폴슨,통제 통제불가 불가 24 24번째 번째 인격 비스트 깨 강철 신체 능력 의문 남자 천재적 두뇌 미스터리 설계자 미스터 글래스 자리 존재 세상 예상
171467,글로리아 벨,7.77,15세 관람가,드라마 멜로/로맨스,세바스찬렐리오,줄리안무어 존터투로,2 로맨스 사랑 수 현실 과정 여자 글로리 글로리아의 아의 드라마
169078,기묘한 가족,6.22,12세 관람가,코미디,이민재,정재영 김남길 엄지원 이수경 정가람 박인환,주유소 트러블 트러블메이커 메이커 만덕 좀비 집안 여타 반반 외모 말귀 쫑비 저마다 속셈 패 패밀리 밀리 비즈니스 가족 리더 며느리 남 남주 주 중심 행동 행동대장 대장 장남 걸과 브레인 차남 민 에너지 담당 막내 해 해걸 걸 죽기 녕 동네 혈기 왕성 마을 이거 때문
180209,기방도령,5.74,15세 관람가,코미디,남대중,준호 정소민 최귀화 예지원 공명,기왕 기왕지사 지사 김 사업 내 기생 말 용모 기예 여심 천성 꽃 꽃도령 도령 허색 색 기 기방 방 연 연풍각 풍각 폐업 위기 조선 최초 남자 결심 다기 다기방결의 결의 맺어 25 괴짜 도인 육갑 기획 홍보 환상 호흡 자랑 최고 여심스틸러 스틸 러 등극 입 입소문 소문 사대부 여인 마음 시작 승승장구 예기 인물 등장 허색의 색의
161967,기생충,8.49,15세 관람가,드라마,봉준호,송강호 이선균 조여정 최우식 박소담 이정은 장혜진,전원 전원백수 백수 길 사이 기 기택송강호 택 송 강호 가족 가족장남 장남 최 식 명문대 친구 연결 고액 과외 자리 고정 고정수입 수입 희망 도움 기대 속 박사 선 선균 균 집 기우 기우글로벌 글로벌 기업 인 박 박사장 사장 저택 도착 사모님 연 연교 교 정가 우 시작 만남 뒤 수 사건
174255,기억할 만한 지나침,7.38,15세 관람가,드라마,박영임,이헌주 몽돌,차 동물 외면 시인 김 삶 죽음 대면 사람 날 남편 말 그녀 저수지 개 발견 시 생 냉담 시선 뿐 이해 고독 속 한 터널 희망 빛 수
183790,긴머리의 친구엄마,0.0,청소년 관람불가,에로,사루타카시,,조용하 얌전 대학생 아들 마코토 친구 아사 아사노 노 내심 안심 집 처음 목표 호시탐탐 준의 육체 기회 남편 출장 탓 외로움 밤 모습 목격 휴대폰 그녀 자위 장면 후 사진 협박 정사 요구 수 대로 몸 번
179506,김군,8.03,12세 관람가,다큐멘터리,강상우,김군 지만원,1980 1980년 5 5월 광주 도심 곳곳 포착 남자 남자군용 군용 트럭 위 군모 무기 눈매 눈매군사평론가 군사 평론가 지 원 북한 북한특수군 특수 군 제1광수 1 광수 명명 누군가 한동네 김 김군 군 기억 사진 장 시작 진실
185131,김복동  ,8.82,12세 관람가,다큐멘터리,송원근,김복동 한지민,일본 사죄 김 김복동 복 동 할머니 27 27년 간 여정 여정포기 포기 수 희망 싸움 이야기 이야기희망
169599,꼬마 물고기 이자벨: 바다 대모험,5.11,전체 관람가,애니메이션 모험,사샤버로우,보니데니슨 토리스펠링 잭워드,아쿠아 움 아빠 꼬마 물고기 이자 독특 외모 바다 속 마무 마무시한 시한 위협 이자벨 벨 리 수
182704,꼬마 자전거 스피디,7.74,전체 관람가,애니메이션,마누엘J가르시아,,마을 꼬마 자전거 세계 최고 레이서 꿈 레이싱 대회 1 1등 슈퍼 슈퍼스타 스타 록 만난 속도 발전 휘발유 모터 주장 오염 비밀 대결 시작 연기 위기 친구 수
136888,나노 테러리즘: CIA 비밀요원,4.0,15세 관람가,스릴러,마크폴리쉬,제임스프레인 다이아나애그론 앤디가르시아 바팔리,대규모 테러 미션 도중 코마 상태 요원 켈 켈리 리 국장 제럴드 입수 기밀 정보 뇌 추출 그것 남편 목숨 위험 수 사실 테 필사적 날 의식 의식불명 불명 손 그녀 모스 부호 시작 비밀 임무 머릿속
158873,나는 다른 언어로 꿈을 꾼다,7.83,15세 관람가,드라마,에르네스토콘트레라스,페르난도알바레스레베일 호세마누엘폰셀리스 엘리지오메렌데즈 파티마몰리나,소멸 위기 고대 토착 언어 시 시크릴 크릴 구사 마지막 원어 원어민 민 이사 이사우로 우로 에바리스토 시절 뒤 말 지 50 50년 언어학자 마르틴 연구 설득 과거 시크릴어의 어의 비밀 숲 속 진짜
178788,나는 예수님이 싫다,6.83,전체 관람가,드라마,오쿠야마히로시,사토유라 오오쿠마리키 채드멀레인,도쿄 시골 마을 전학 소년 유 유라 라 기만 날 앞 예수 다이 학교 친구 주세 소원 특별 일상 예기 사건
181320,나는 원래 대전에서 로맨틱 코미디를 찍으려고 했었다,8.14,12세 관람가,드라마,배기원,이종철 조하영 이민아,대전 활동 변 변감독 감독 시나리오 수업 생계 유지 날 단편 단편영화 영화 칸 영화제 쇼트 쇼트필름코너 필름 코너 상영 소식 기쁨 주변 예상 우여곡절 끝 간 프랑스 수상 여배우 사라
173668,나랏말싸미,3.38,전체 관람가,드라마,조철현,송강호 박해일 전미선,문자 지식 권력 독점 시대 신하 반대 훈민정음 창제 세종 마지막 8 8년나라 나라 임금 천한 신분 스님 신미 백성 뜻 글자 시작 아무 한글 이야기 이야기1443 1443 불굴 신념 역사 기록
175324,나를 찾아줘,6.85,15세 관람가,스릴러,김승우,이영애 유재명 박해준 이원근,6 6년 전 실종 아들 연락 정연 영애 반복 거짓 제보 생김새 흉터 이의 이야기 지체 곳 등장 경계 경찰 홍경 홍경장유재명 장유 재명 적도 마을 사람 있음 직감 포기 진실 시작
186241,나만 없어 고양이,7.53,전체 관람가, ,복운석,김소희 허정도 권수정 김기천 김희철,생애 이별 극복 중인 20 20살 살 청춘 나래 집사 겐 사랑 남친 남친냥 냥 직장 기러기 아빠 김 김과장 과장 희망 홉 홉냥 복 고양이 동생 발레 소녀 수정 멋 멋짐 짐 낭만 낭만냥 수연 아내 할아버지 석 석봉 봉 정 순 감정 순간 갓 갓냥
177909,나쁜 녀석들: 더 무비,6.43,15세 관람가,범죄 액션,손용호,마동석 김상중 김아중 장기용,죄수 탈출 교도소 호송 호송차량 차량 전복 최악 범죄자 탈주 사상 초유 사건 발생 경찰 수감 중인 흉악범 극비 프로젝트 특수 특수범죄수사과 범죄 수사과 소집 미친개 김 중 반장 과거 활약 전설 주먹 박 박웅철마동석 웅 철마 동석 감성 사기꾼 곽 곽노순김 노 순 중과 전직 형사 고유 고유성장기용 성장 기용 영입 팀 구성 멤버 합류 독 독해진 해진 녀석 수록 배후 거대 범죄조직 조직 직감 놈 소탕 시작 법 검거 검거작전놈 작전 생각 행동
187979,나의 노래는 멀리멀리,9.53,전체 관람가,다큐멘터리,현진식,김지희 이순도,연주가 장기 풋내기 기타리스트 리스트 김 희기 희기타 타 꿈 스물 스물넷 소 감정 표현 연주 제자리 고민 무대 위 일상 엄마 뒤 지희 날 노래 목 목소리 소리 마음 곳 간직 소녀 희망 전 시작
171490,나의 작은 시인에게,8.45,15세 관람가,드라마,사라코랑겔로,매기질렌할 파커세바크,유치원 리 반복 일상 속 시 예술적 욕망 충족 재능 학생 살 지미 천재적 있음 발견 시수업 수업 발표
175366,나의 특별한 형제,8.92,12세 관람가,드라마 코미디,육상효,신하균 이광수 이솜,비상 두뇌 동생 동구 데 형 세 하균 균 수영 수영실력 실력 세하 아무것 동구이광수이들 피 방울 20 20년 몸 특별 형제다 제다 날 형제 보금자리 책임 집 운영 신부님 모든 지원금 장애 사람 위기 구청 수영장 알바 이자 취 생 미 미현 현 솜 수영코치 코치 영입 수영대회 대회 출전 이목 집중 성공 수 희망 예상 인물 앞 등장 새
177757,나의 히어로 아카데미아 더 무비: 두 명의 히어로,9.39,전체 관람가,애니메이션,나가사키켄지,야마시타다이키 오카모토노부히코 미야케켄타 시다미라이 사쿠라아야네 이시카와카이토,개성 초능력 세계 무개성 소년 대신 히 히어로 어로 조건 1 마이트 뒤 새 영웅 탄생 탄생개성 세상 수
189000,나이브스 아웃,9.11,12세 관람가,미스터리 스릴러,라이언존슨,다니엘크레이그 크리스에반스 아나디아르마스 제이미리커티스 토니콜렛 마이클섀넌 돈존슨 키스스탠필드 캐서린랭포드 제이든마텔 크리스토퍼플러머,베스트셀러 미스터리 작가 85 85세 세 생일 채 발견 죽음 원인 경찰 탐정 브누아 블랑 파견
177451,나이트메어 시네마,3.76,청소년 관람불가,공포,알레한드로브뤼게,미키루크 엘리자베스리저 모리스버나드 리차드체임벌린,밤 진 극장 듯 명의 그림자 속 의문 영사 영사기사 기사 내면 공포 이야기
127386,난폭한 기록,3.74,청소년 관람불가,액션 범죄,하원준,정두홍 류덕환 서은아,특종 냄새 귀신 집념 프리랜서 국 국현 현 덕 덕환은 환은 자극적 취재 취재거리 거리 중머리 칼날 채 전직 전직형사 형사 기만 기만정 정 홍 이야기 대박 아이템 아이템임 임 직감 폐인 삶 설득 끝 동료 동료형사 마약 마약조직보스 조직 보스 정태화 복수 기록 조건 조건하에 하에 동행 동행취재 허락 악인 통쾌 복 리얼 액션 폭발
181114,날씨의 아이,7.97,15세 관람가,애니메이션,신카이마코토,심규혁 김유림 최한 강은애 이장원 손정아 다이고코타로 모리나나 오구리슌 혼다츠바사 히라이즈미세이,비 여름날 여름날가출 가출 소년 수상 잡지사 취직 비밀 소녀 히 지금 하늘 거 그녀 기도 거짓말 빗줄기 사람 얼굴 빛 기해 날씨 감정 뒤 세계 세상 시작 끝
190383,남편 친구와 즐기는 육덕아내,10.0,청소년 관람불가,에로 드라마,오오사키히로코우지,,오우 마나 마나미 미 성적 취향 독특 남편 부끄러움 평소 속옷 채 생활 중 동료 이토 집 초대 며칠간 마나미가 미가 욕구 사이 그녀 접근 처음 거부 관계 계획 사실 사람 둘만 만
190350,남편상사들,0.0,청소년 관람불가,드라마 멜로/로맨스,나기라겐조,,직장 연애 끝 결혼 후 퇴사 리 날 남편 물건 회사 가게 신임 본부장 노 마음 파트 파트타임 타임 음란 욕정 욕정남편 승진 빌미 당황
190345,남편이 알면 맞아죽을 관계-새엄마는 초거유,0.0,청소년 관람불가,에로,코지마유키오,,7 7년 전 부모님 반대 애가 남자 재혼 나치 그녀 그중 막내 막내인 인 유지 가족 관계 형 유타 한참 총각 딱지 소심 동정남 놀림 일쑤 떼 떼주고 주고 가지 스킬 며칠 뒤 방 평소 찰나 느낌 쌍둥이 유 유이치 이치 새엄마 부탁 앞 남편 눈 붓 붓아들 아들
190360,"낮에는 여상사, 밤에는 나의 비서",0.0,청소년 관람불가,에로 드라마,야츠에소타,,회사 부장 코 코바 바 카 레이 레이코 그녀 단점 그것 지위 이용 부하 직원 갑 사실 상사 직 직원인 원인 시 시타 타 무 희롱 전무 고발 유혹 불만 눈 심
190344,낮잠자는 새엄마의 속옷이 보이고,0.0,청소년 관람불가,에로,스즈키하루오,,자식 남자 재혼 시아버지 병환 남편 집 마음 곳 웠 대학생 아들 마사 가슴 패티 패티쉬 쉬 마사시 시 새엄마 다가 애무 붓 붓아들 관계 시작 지 2 2년 그녀 가기 전 욕구 욕구불만 불만
187504,내 여자의 남자들,9.0,청소년 관람불가,드라마 멜로/로맨스,최정자,,건축 건축회사 회사 애인 한철 결혼 어린이 어린이집 집 교사 민지 민지결혼자금 자금 오피스 걸 2 2중 중 생활 중인 선배 현 현정 정 보도 실장 소개 보도실장 앞 수치 면접 모든 자존심 결정 손님 운 인간적 남자 근호 단골 단골손님 마음 시작 민지결국 파기 다이 다이미 미 직장 상사 상사이자 이자 선배언니 언니 현정의 정의 생활과 관계 현정과 정과
147036,내 완벽한 남사친의 비밀,8.54,12세 관람가,코미디 멜로/로맨스,핀테일러,케이트미쿠치 숀애스틴 스티브호웨이 저스틴채트윈,강아지 밋 고양이 에이잭스 일상 엠 수로 서밋 엠마 마 슬픔 날 남자 명이 앞 녀의 남 남사친 사친 자청 마법 내 사랑 진짜
136279,내 이웃과의 섹스라이프,10.0,청소년 관람불가,코미디 드라마,매튜해멧노트,테사피크-존스 조이스로렌스 제임스노턴,보수적 과부 주 주디 디 딸 릴 릴리 리 스쿨 중퇴 섹스 보 보노 노 원숭이 행동 원칙 단체 하우스 충격 사랑 해 슬로건 수장 아니타 여자 독특 성격 소유자 그녀 엄마 갈등 주디스 하룻밤 해결 거 서로 주장 이전 방법 테스트 상황
174297,내가 사는 세상,7.81,12세 관람가,드라마,최창환,곽민규 김시은,꿈 밍구스 현실 알바 민규꿈 아티스트 새끼 새끼강사 강사 시은 시은오늘 오늘 비겁 내일 진짜 요즘 애 칫 청춘 스케치
182342,내아내의제자들,0.0,청소년 관람불가,멜로/로맨스,정민용,유니 유진 시우 상두,임신 입덧 심 친정 선생님 집 남편 동생 걱정 말 연지 친구 수 그녀 사실 집안일 적도 집안 상황 마음 불편 고민 때문 오랫동안 철 몸 위로 위로해주기 해 주기 결심 유혹
164172,내안의 그놈,8.16,15세 관람가,판타지 코미디,강효진,진영 박성웅 라미란,엘리트 아재 판 판수박 수박 웅를 옥상 고등학생 동 동현진영 현 진영 제대 판수 동현 몸 첫사랑 미선 미선라미란 라 미란 존재 딸 현정이 현정이수민 수민 대유 대유잼 잼 향연
182392,내친구의두엄마,2.0,청소년 관람불가,멜로/로맨스,정민용,유니 유진 시우 상두,민호 아빠 애인 연주 상미 이혼 수 위 위자료 자료 말 으라며 달 안 빈털터리 아빠민호 민 호 엄마 위로 가정 뭐 돈 때문 연주자신 유혹 거부 가지 아이디어 적 친구 친구인형진 인형 진 집 부탁 민호예전 예전 계획 상미얼마 후 연주가 형 형진 민호가 호가 자리 모습 영상 그녀 상미자신 노력 남편 거 거라 라 미안 미안하다 하다 앞 형진결국
187787,너를 만난 여름,8.38,12세 관람가,드라마 멜로/로맨스,장적사,진비우 하람두,최고 내가 계절 여름
159854,너의 목소리,8.5,전체 관람가,애니메이션 드라마,이토나오유키,카타히라미나 미모리스즈코,16 16살 살 나기 나기사 말 희망 화가 영혼 영혼고토 고토 마을 날 하교 하교길 길 친구 가에데 기사 아쿠아 아쿠아마린 마린 주인 카페 라디오 부스 발견 곳 속마음 한편 사연 익명 제보자 편지 여름 기적 시작
183660,너의 여자친구,7.98,12세 관람가,코미디 멜로/로맨스 드라마,이장희,이엘리야 지일주,눈 시작 대학교 축제 자칭 공대 브레인 져스 현실 모태 모태솔로 솔로 9888 9888일 3 3인방의 인 방의 로봇 동아리 소 앞 직진 직진녀 녀 혜진글 튜브 연애 연애세포 세포 올겨울 솔 탈출 수
190847,노래방 : 화끈한 여자들2,10.0,청소년 관람불가,에로,이민우,해일 민우 지성 지아 예진 서아,노래방 도우미 손님 만 발길 지가 직접 결심 친구 성희 영입 미모 서비스 소문 가게 시작 돈 그녀 생각 비장 특급
183877,노무현과 바보들,6.76,12세 관람가,다큐멘터리,김재희,노무현,1981 1981년 부 사건 변호인 변호인1988년 1988 청문회 스타 제13대 13 대 국회의원 국회의원1998년 1998 오뚝이 인생 제15대 15 국회의원2002년 2002 꼴찌 반란 대선 대선후보 후보 선출 선출20032008년 20032008 16 16대 대한 대한민국 민국 대통령 재임 재임2009년 2009 5 5월 23 23일 서거 서거그로 그로 10 10년바보 바보 노무현 기억 사람 이야기
137910,노벰버 크리미널즈,3.36,15세 관람가,범죄 드라마 미스터리,사차제바시,클로이모레츠 안셀엘고트 캐서린키너 데이빗스트라탄,교내 퀸 퀸카 카 피비 로이 모레츠 짝사랑 고등학생 디 디안셀 안 셀 엘 엘고트 고트 그날 절 피터 총기 살해 경찰 학교 도 죽음 흔적 위험 추적 시작
190371,노크: 낯선 그림자,7.44,청소년 관람불가,공포 스릴러,오슨오브로위츠,자넬패리쉬 페어루자볼크 안젤라트림버,권태 권태기의 기의 커플 관계 개선 고급 빌라 친구 초대 밤 이웃 그녀 차 문제 현관 앞 4 4명 명 그것 여자 해결 수 집 행동 곤경 사실 처치 예상 괴한 침입
179416,녹차의 중력,10.0,전체 관람가,다큐멘터리,정성일,임권택,여름날 정 정성일 성일 임 택 감독 영화 현장 다큐멘터리 허락 가지 이유 뿐 1962 1962년 번째 101 101편 편 한국 대가 일임 세상 속 중력 유지 그루 나무 거기 바람 해 계절 녹차 잔 겨울 1 1월 1일 102 102번째 촬영 곁 마음
173413,논-픽션,7.74,15세 관람가,드라마,올리비에아사야스,줄리엣비노쉬 기욤까네 빈센트맥케인,종이 종이책 책 북 사이 고민 성공 편집장 알랭부부 욕망 스타 스타배우 배우 셀 셀레 레 나의 연애 작가 레오나르남편 오나 르 남편 정치인 비서관 발레리 발레리종이책의 책의 시대 디지털 마 터 로르 완벽 파 파리지 리지 의지 토크 폭죽
168054,누구나 아는 비밀,7.78,15세 관람가,드라마,아쉬가르파라디,페넬로페크루즈 하비에르바르뎀,동생 결혼식 참석 고향 라 라우라오랜만 우 오랜만 가족 마을 사람 파티 중 중사랑 사랑 딸 거액 몸값 요구 메시지 라우라와 우라와 그녀 친구 친구이자 이자 과거 연인 파 파코 코 주변인 시작 거 이야기 라우 수록 긴장감 속 서로 의심 지금 비밀
188550,누나의 속사정,5.0,청소년 관람불가,멜로/로맨스,이가온,,취업 청춘 준영 희수 희수서로 서로 사랑 가망 민 끝 역할 역할극 극 섹스 라 복면 집 탐색 보안 집미선 미선 침입 긴장 탓 냉장고 맥주 술 정신 방 잠 남자 영를 생각 슬립 침 사람 누 먼저 먼저라
190395,눈의 여왕4,9.2,전체 관람가,애니메이션 모험 가족 판타지,로버트렌스,양정화 박지윤 임채헌,과학 기술 최고 해럴드 왕 발견 마법 유물 미러 미러랜드 랜드 문 이용 세상 마법사 그곳 계략 위험 겔다 가족 최후 수단 눈 여왕 도움 요청 힘 음모 세계 수
182756,늑대의 아이들,5.1,15세 관람가,드라마 공포,아드리안페넥,카밀폴니시아크 다누타스텐카 니콜라스프리고다,강제 수용소 해방 9 9명 명 숲 속 저택 식량 옷 곳 유일 보모 늑대 살해 음식 물 황무지 위험 고아원 안 전쟁 생존 생존기 기 이제 시작
